{
  "action": "would-promote",
  "applied": false,
  "approval_sha256": "ed6fd767b6f69a0fbdc5467d3464105a6ef69e51754c9abdae882c44fe27af48",
  "plan_sha256": "9374c5f7ec16a8717e8f703d17bfeeedb93c9e2a6f29783bc7cb301b31791877",
  "proposal_id": "proposal-6513a40962cd5cb2",
  "schema_version": 1,
  "status": "ok",
  "target_files": [
    {
      "content_sha256": "0e97882577a9114584ad76e808e8e69bf79342cf1317436ef1f1c2795fa98d4e",
      "current_sha256": null,
      "expected_sha256": null,
      "kind": "failing-test",
      "path": "tests/test_maintenance_candidate_usage_resource.py",
      "state": "would-create"
    }
  ]
}
